{
  "slug": "typo-elastique",
  "title": "Typo élastique",
  "type": "typography",
  "description": "Un mot ou un logo découpé en grille dont les colonnes s'étirent en rythme (onde, lentille, battement). Boucle parfaite, export PNG HD, SVG vectoriel et vidéo.",
  "tags": ["cinetique", "grille", "boucle", "deformation", "logo", "svg"],
  "author": "cursor",
  "created": "2026-10-28",
  "status": "finished"
}
